이름,영어 이름,설명,제품 사진
아이스 그랜마 애플 블랙 티,Iced Grandma Apple Black Tea,"잉글리쉬 브렉퍼스트 티와 신선한 사과, 시나몬과 레몬의 가벼운 터치가
마치 할머니의 비밀 레시피같은 묘한 매력의 그랜마 애플 블랙 티를 소개합니다.

오직, Teavana Bar 매장에서만 만날 수 있습니다.",https://image.istarbucks.co.kr/upload/store/skuimg/2018/12/[9200000001930]_20181226180250814.jpg
아이스 라임 패션 티,Iced Lime Passion Tea,"새콤달콤한 히비스커스와 라임의 
이국적인 조화가 매력적인 라임 패션 티를 만나보세요!",https://image.istarbucks.co.kr/upload/store/skuimg/2019/01/[9200000001933]_20190114160516783.jpg
아이스 민트 블렌드 티,Iced Mint Blend Brewed Tea,"스피어민트, 페퍼민트, 레몬버베나가 블렌딩된 상쾌한 허브 티 입니다.
(약 5분 정도의 티 추출 시간이 소요됩니다.)",https://image.istarbucks.co.kr/upload/store/skuimg/2016/09/[4004000000059]_20160905100053426.jpg
아이스 유스베리 티,Iced Youthberry™Brewed Tea,"아사이베리, 히비스커스, 장미 꽃잎의 핑크빛 컬러가 감도는 수색과 베리류의 새콤함을 느낄 수 있는 화이트 티 입니다.",https://image.istarbucks.co.kr/upload/store/skuimg/2016/09/[9200000000229]_20160905094710349.jpg
아이스 유자 민트 티,Iced Yuja Mint Tea,"달콤한 유자와 알싸하고 은은한 진저, 
우릴 수록 상쾌한 민트 티가 조화로운 유자 민트 티.
오직 티바나 바 매장에서만 만날 수 있습니다.",https://image.istarbucks.co.kr/upload/store/skuimg/2019/10/[9200000002574]_20191024172411440.jpg
아이스 잉글리쉬 브렉퍼스트 티,Iced English Breakfast Brewed Tea,"인도 아삼, 스리랑카 실론, 중국의 홍차가 블렌딩 된 깊고 그윽한 블랙 티 입니다.
(약 5분 정도의 티 추출 시간이 소요됩니다.)",https://image.istarbucks.co.kr/upload/store/skuimg/2016/09/[4004000000019]_20160905100755211.jpg
아이스 제주 유기 녹차,Iced Jeju Organic Green Tea,"우수한 품질의 제주도 산 유기 녹차로만 이루어져 맑은 수색과 신선한 향, 맛이 뛰어난 녹차 입니다.
(약 3분 정도의 티 추출 시간이 소요됩니다.)",https://image.istarbucks.co.kr/upload/store/skuimg/2016/09/[400400000094]_20160905100927573.jpg
아이스 차이 티,Iced Chai Brewed Tea,"진저, 카르다몸, 이국적인 풍미의 시나몬 등이 블렌딩된 블랙 티 입니다.
(약 5분 정도의 티 추출 시간이 소요됩니다.)",https://image.istarbucks.co.kr/upload/store/skuimg/2016/09/[4004000000049]_20160905101031391.jpg
아이스 캐모마일 블렌드 티,Iced Chamomile Blend Brewed Tea ,"캐모마일과 라벤더의 부드러운 꽃향이 어우러진 허브 티 입니다.
(약 5분 정도의 티 추출 시간이 소요됩니다.)",https://image.istarbucks.co.kr/upload/store/skuimg/2016/09/[4004000000079]_20160905101225311.jpg
아이스 히비스커스 블렌드 티,Iced Hibiscus Blend Brewed Tea,"히비스커스, 사과의 풍부한 산미, 레몬그라스 등이 블렌딩된 허브 티 입니다.
(약 5분 정도의 티 추출 시간이 소요됩니다.)",https://image.istarbucks.co.kr/upload/store/skuimg/2016/09/[4004000000069]_20160905101347336.jpg
유스베리 티,Youthberry™Brewed Tea,"아사이베리, 히비스커스, 장미 꽃잎의 핑크빛 컬러가 감도는 수색과 베리류의 새콤함을 느낄 수 있는 화이트 티 입니다.",https://image.istarbucks.co.kr/upload/store/skuimg/2016/09/[9200000000226]_20160902191950468.jpg
유자 민트 티,Yuja Mint Tea,"달콤한 유자와 알싸하고 은은한 진저, 
우릴 수록 상쾌한 민트 티가 조화로운 유자 민트 티.
오직 티바나 바 매장에서만 만날 수 있습니다.",https://image.istarbucks.co.kr/upload/store/skuimg/2019/10/[9200000002572]_20191024172324362.jpg
잉글리쉬 브렉퍼스트 티,English Breakfast Brewed Tea,"인도 아삼, 스리랑카 실론, 중국의 홍차가 블렌딩 된 깊고 그윽한 블랙 티 입니다.",https://image.istarbucks.co.kr/upload/store/skuimg/2016/09/[4004000000016]_20160905101803567.jpg
자몽 허니 블랙 티,Grapefruit Honey Black Tea,새콤달콤한 자몽과 꿀이 깊고 그윽한 풍미의 스타벅스 티바나의 블랙 티와 만났습니다. 화려한 색감과 톡 쏘는 상큼함이 더해진 스타벅스의 새로운 티 음료입니다.,https://image.istarbucks.co.kr/upload/store/skuimg/2016/08/[9200000000187]_20160831101015979.jpg
제주 유기 녹차,Jeju Organic Green Tea,"우수한 품질의 제주도 산 유기 녹차로만 이루어져 맑은 수색과 신선한 향, 맛이 뛰어난 녹차 입니다.",https://image.istarbucks.co.kr/upload/store/skuimg/2016/09/[400400000091]_20160905101907111.jpg
차이 티,Chai Brewed Tea ,"진저, 카르다몸, 이국적인 풍미의 시나몬 등이 블렌딩된 블랙 티 입니다.",https://image.istarbucks.co.kr/upload/store/skuimg/2016/09/[4004000000046]_20160905102520658.jpg
캐모마일 블렌드 티,Chamomile Blend Brewed Tea ,캐모마일과 라벤더의 부드러운 꽃향이 어우러진 허브 티 입니다.,https://image.istarbucks.co.kr/upload/store/skuimg/2016/09/[4004000000076]_20160905102720294.jpg
히비스커스 블렌드 티,Hibiscus Blend Brewed Tea ,"히비스커스, 사과의 풍부한 산미, 레몬그라스 등이 블렌딩된 허브 티 입니다.",https://image.istarbucks.co.kr/upload/store/skuimg/2016/09/[4004000000066]_20160905103109779.jpg
말차 레모네이드 프로즌 티,Malcha Lemonade Frozen Tea,"제주도에서 유기농으로 재배한 어릿 녹찻잎으로 만든
국내 최고등급의 말차와
상큼한 레몬으로 만든 셔벗 스타일의 프로즌 티.
말차의 감칠맛이 레몬과 만나 환상적인 청량감을 줍니다.",https://image.istarbucks.co.kr/upload/store/skuimg/2020/04/[9200000002948]_20200410105103001.jpg
아이스 자몽 허니 블랙 티,Iced Grapefruit Honey Black Tea,새콤달콤한 자몽과 꿀이 깊고 그윽한 풍미의 스타벅스 티바나의 블랙 티와 만났습니다. 화려한 색감과 톡 쏘는 상큼함이 더해진 스타벅스의 새로운 티 음료입니다.,https://image.istarbucks.co.kr/upload/store/skuimg/2016/08/[9200000000190]_20160831101044765.jpg
패션 푸르트 칵테일 티,Passion Fruit Cocktail Tea,"달콤한 패션 푸르트와 새콤한 레몬, 티바나 패션탱고 티가
완벽하게 조화를 이룬 칵테일 스타일의 티 음료입니다.
패션 푸르트 씨앗으로 씹는 재미까지 즐겨 보세요.",https://image.istarbucks.co.kr/upload/store/skuimg/2020/04/[9200000002949]_20200410105319181.jpg
그랜마 애플 블랙 밀크 티,Grandma Apple Black Milk Tea,"그랜마 애플 블랙 티의 밀크 티 버전.
시나몬과 사과로 만든 할머니의 비밀 레시피로 
블랙 티의 풍미가 더욱 풍부해졌습니다.
콜드 폼 위에 올려진 앙증맞은 사과모양이 포인트인
그랜마 애플 블랙 밀크 티를 티바나 바 / 리저브 바에서 느껴보세요.",https://image.istarbucks.co.kr/upload/store/skuimg/2019/10/[9200000002568]_20191024172150506.jpg
돌체 블랙 밀크 티,Dolce Black Milk Tea,"진한 홍차에 부드러운 우유와 연유 시럽으로 향긋하고 
달콤하게 맛을 낸 스타벅스만의 돌체 블랙 밀크 티를
오직 티바나 바 매장에서만 만날 수 있습니다.",https://image.istarbucks.co.kr/upload/store/skuimg/2019/10/[9200000002564]_20191024172011855.jpg
아이스 그랜마 애플 블랙 밀크 티,Iced Grandma Apple Black Milk Tea,"그랜마 애플 블랙 티의 밀크 티 버전.
시나몬과 사과로 만든 할머니의 비밀 레시피로 
블랙 티의 풍미가 더욱 풍부해졌습니다.
콜드 폼 위에 올려진 앙증맞은 사과모양이 포인트인
그랜마 애플 블랙 밀크 티를 티바나 바 / 리저브 바에서 느껴보세요.",https://image.istarbucks.co.kr/upload/store/skuimg/2019/10/[9200000002570]_20191024172240718.jpg
아이스 돌체 블랙 밀크 티,Iced Dolce Black Milk Tea,"진한 홍차에 부드러운 우유와 연유 시럽으로 향긋하고 
달콤하게 맛을 낸 스타벅스만의 돌체 블랙 밀크 티를
오직 티바나 바 매장에서만 만날 수 있습니다.",https://image.istarbucks.co.kr/upload/store/skuimg/2019/10/[9200000002566]_20191024172100821.jpg
아이스 제주 유기농 말차로 만든 라떼,Iced Malcha Latte from Jeju Organic farm,차광재배한 어린 녹찻잎을 곱게 간 제주 유기농 말차를 사용하였습니다. 깊고 진한 말차 본연의 맛과 향을 시원하고 부드럽게 즐길 수 있는 제주 유기농 말차로 만든 라떼를 만나보세요.,https://image.istarbucks.co.kr/upload/store/skuimg/2019/12/[9200000002499]_20191227100221314.jpg
아이스 차이 티 라떼,Iced Chai Tea Latte,부드러운 우유에 이국적인 스파이시한 풍미가 특징적인 티 라떼 입니다.,https://image.istarbucks.co.kr/upload/store/skuimg/2015/08/[135612]_20150813231332126.jpg
제주 유기농 말차로 만든 라떼,Malcha Latte from Jeju Organic farm,차광재배한 어린 녹찻잎을 곱게 간 제주 유기농 말차를 사용하였습니다. 깊고 진한 말차 본연의 맛과 향을 부드럽게 즐길 수 있는 제주 유기농 말차로 만든 라떼를 만나보세요.,https://image.istarbucks.co.kr/upload/store/skuimg/2019/12/[9200000002496]_20191227100637687.jpg
차이 티 라떼,Chai Tea Latte,부드러운 우유에 이국적인 스파이시한 풍미가 특징적인 티 라떼 입니다.,https://image.istarbucks.co.kr/upload/store/skuimg/2016/09/[135608]_20160905102333436.jpg
시그니처 핫 초콜릿,Signature Hot Chocolate,유럽 스타일의 진한 핫 초콜릿으로 휘핑크림과 코코아 파우더가 토핑된 음료.,https://image.istarbucks.co.kr/upload/store/skuimg/2015/08/[72]_20150813231821817.jpg
아이스 시그니처 초콜릿,Iced Signature Chocolate,진한 초콜릿과 시원한 우유에 휘핑과 코코아 파우더가 얹어진 음료.,https://image.istarbucks.co.kr/upload/store/skuimg/2015/07/[110621]_20150723005650154.jpg
플러피 판다 핫 초콜릿,Fluffy Panda Hot Chocolate,"고소한 헤이즐넛과 진한 핫초콜릿의 만남,
귀여운 판다까지 더해진 플러피 판다 핫 초콜릿! 

* 용인에버랜드R 매장에서만 판매하는 음료입니다",https://image.istarbucks.co.kr/upload/store/skuimg/2019/12/[9200000002594]_20191212184806609.jpg
매직 윈터 트로피컬 핫 펀치,Magic Winter Tropical Hot Punch,"새콤달콤한 파인애플과 패션후르츠의 환상적인 만남, 
남녀노소 따뜻하게 즐길 수 있는 매직 윈터 트로피컬 핫 펀치!

* 용인에버랜드R 매장에서만 판매하는 음료입니다",https://image.istarbucks.co.kr/upload/store/skuimg/2019/12/[9200000002595]_20191212184851930.jpg
스팀 우유,Steamed Milk,부드럽고 담백한 따뜻한 우유.,https://image.istarbucks.co.kr/upload/store/skuimg/2015/07/[17]_20150723005119588.jpg
아이스 라임 플로터,Iced Lime Floater,"[더종로R,청담스타R,한강진역R,홍대입구역사거리R 전용음료] 라임, 민트 그리고 리저브 콜드 브루 샷으로 스타벅스 리저브만의 색깔로 변주한 모히토 음료입니다.",https://image.istarbucks.co.kr/upload/store/skuimg/2017/02/[9200000000429]_20170220161700284.jpg
아이스 오렌지 플로터,Iced Orange Floater,"[더종로R,청담스타R,한강진역R,홍대입구역사거리R 전용음료] 오렌지의 상큼함과 리저브 콜드 브루 샷이 상쾌하게 느껴지는 리프레쉬 음료입니다.",https://image.istarbucks.co.kr/upload/store/skuimg/2017/02/[9200000000428]_20170220161626370.jpg
아이스 제주 까망 라떼,Iced Jeju Black Sesame Latte,"[제주지역 한정음료] 제주도의 돌담길과 하르방의 풍경을 제주 까망 라떼로 느껴보세요.
고소한 흑임자와 달콤한 소보로 토핑으로 시원하게 누구나 즐길 수 있는 음료입니다.
",https://image.istarbucks.co.kr/upload/store/skuimg/2018/04/[9200000001302]_20180418152834957.jpg
아이스 제주 레드 빈 라떼,Iced Jeju Red Bean Latte,"[제주지역 한정음료] 제주 화산송이를 형상화한 음료로
국내산 레드 빈으로 표현한 뉴트로 음료로 고급진 레드 빈의 맛을
제주 스타벅스에서 즐겨보세요.",https://image.istarbucks.co.kr/upload/store/skuimg/2020/02/[9200000002670]_20200220135516892.jpg
아이스 제주 청보리 라떼,Iced Jeju Green Barley Latte,"[제주지역 한정음료] 제주 바람의 숲 가파도를 연상시키는
음료로 청보리의 풋풋하고 고소함이 함께 느껴지는 음료.
제주 청보리 라떼로 가파도 길을 느껴보세요.",https://image.istarbucks.co.kr/upload/store/skuimg/2020/02/[9200000002667]_20200220135233855.jpg
우유,Milk,고소하고 담백한 신선한 우유.,https://image.istarbucks.co.kr/upload/store/skuimg/2015/07/[18]_20150723002143240.jpg
제주 까망 라떼,Jeju Black Sesame Latte,"[제주지역 한정음료] 제주도의 돌담길과 하르방의 풍경을 제주 까망 라떼로 느껴보세요.
고소한 흑임자와 달콤한 소보로 토핑으로 누구나 즐길 수 있는 음료입니다.",https://image.istarbucks.co.kr/upload/store/skuimg/2018/04/[9200000001301]_20180418152720677.jpg
제주 레드 빈 라떼,Jeju Red Bean Latte,"[제주지역 한정음료] 제주 화산송이를 형상화한 음료로
국내산 레드 빈으로 표현한 뉴트로 음료로 고급진 레드 빈의 맛을
제주 스타벅스에서 즐겨보세요.",https://image.istarbucks.co.kr/upload/store/skuimg/2020/02/[9200000002669]_20200220135416460.jpg
제주 쑥쑥 라떼,Jeju Mugwort Latte,"[제주지역 한정음료] 제주의 푸릇푸릇한 쑥 향을 느끼며 건강과 
힐링을 즐기는 음료로 제주의 오름길을 상징하는 음료. 
제주 쑥으로 향긋하고 푸릇푸릇한 쑥 향을 느끼며 
건강과 힐링을 느낄 수 있는 Non Coffee음료.",https://image.istarbucks.co.kr/upload/store/skuimg/2019/02/[9200000002089]_20190221165720149.jpg
제주 청보리 라떼,Jeju Green Barley Latte,"[제주지역 한정음료] 제주 바람의 숲 가파도를 연상시키는
음료로 청보리의 풋풋하고 고소함이 함께 느껴지는 음료.
제주 청보리 라떼로 가파도 길을 느껴보세요.",https://image.istarbucks.co.kr/upload/store/skuimg/2020/02/[9200000002666]_20200220135145737.jpg
레드 선라이즈 270ML,Red Sunrise 270ML,강렬한 에너지가 느껴지는 뿌리 채소와 상큼한 과일,https://image.istarbucks.co.kr/upload/store/skuimg/2019/06/[9300000002118]_20190626102229661.jpg
옐로우 패션 270ML,Yellow Passion 270ML,생기 발랄함이 가득 느껴지는 사과와 패션후르츠,https://image.istarbucks.co.kr/upload/store/skuimg/2019/06/[9300000002119]_20190626102349286.jpg
파인 그린 270ML,Fine Green 270ML,초록의 싱그러움을 가득 담은 초록 채소와 열대 과일,https://image.istarbucks.co.kr/upload/store/skuimg/2019/06/[9300000002117]_20190626101849029.jpg
딸기주스 190ML,Strawberry Juice 190ML,달콤한 국내산 딸기의 과육이 듬뿍 느껴지는 주스,https://image.istarbucks.co.kr/upload/store/skuimg/2019/06/[5210008070]_20190627152902146.jpg
망고주스 190ML,Mango Juice 190ML,노랗게 익은 열대과일 망고가 입안 가득 느껴지는 주스,https://image.istarbucks.co.kr/upload/store/skuimg/2019/06/[5210008061]_20190627152423130.jpg
수박주스 190ML,Watermelon Juice 190ML,수박의 시원함과 달콤함이 풍성하게 느껴지는 주스,https://image.istarbucks.co.kr/upload/store/skuimg/2019/06/[9300000002115]_20190626101440372.jpg
케일&사과주스 190ML,Kale&Apple Juice 190ML,국내산 케일과 사과의 달콤함이 조화로운 녹색 주스,https://image.istarbucks.co.kr/upload/store/skuimg/2019/06/[5210008072]_20190627153051165.jpg
토마토주스 190ML,Tomato Juice 190ML,국내산 토마토의 풍성한 과육이 듬뿍 담겨있는 주스,https://image.istarbucks.co.kr/upload/store/skuimg/2019/06/[5210008074]_20190627153254176.jpg
한라봉주스 190ML,Hallabong Juice 190ML,새콤달콤한 황금빛 제주 한라봉을 그대로 담아낸 주스,https://image.istarbucks.co.kr/upload/store/skuimg/2019/06/[5210008055]_20190627152215054.jpg
햇사과 주스 190ML,Newly Harvested Apple Juice 190ML,"햇사과 1개 반을 껍질 그대로 착즙한 사과 주스.
달콤새콤한 사과 주스를 신선하게 즐겨 보세요.",https://image.istarbucks.co.kr/upload/store/skuimg/2019/12/[9300000002565]_20191205134634845.jpg
블루베리 요거트 190ML,Blueberry Yogurt 190ML,블루베리 과육이 입안 가득 느껴지는 마시는 요거트,https://image.istarbucks.co.kr/upload/store/skuimg/2019/06/[5210008063]_20190627152600395.jpg
치아씨드 요거트 190ML,Chiaseed Yogurt 190ML,톡톡 터지는 치아 씨드가 입안 가득 느껴지는 마시는 요거트,https://image.istarbucks.co.kr/upload/store/skuimg/2019/06/[5210008064]_20190627152728532.jpg
